{
  "schema_version": 1,
  "id": "naval-combat-archetypes",
  "name": "Naval Combat Archetypes",
  "kind": "strategy",
  "status": "integrated",
  "summary": "Data templates for patrol craft, missile corvettes, destroyers, submarines, landing ships, and carriers with clear counter roles.",
  "sources": [
    {
      "project": "combined-arms",
      "commit": "ab9e477c3db818e91946d4cfdc86e71012966141",
      "paths": [
        "mods/ca/rules/ships.yaml"
      ],
      "notes": "Mechanic or architecture reference only; no upstream story or binary presentation content imported."
    }
  ],
  "license": {
    "code": "GPL-3.0-or-later",
    "assets": "No upstream binary assets imported; original or native OpenRA presentation is required.",
    "redistribution": "allowed",
    "attribution": [
      "Combined Arms contributors"
    ]
  },
  "compatibility": {
    "target_mod": "ra",
    "engine_api": "native",
    "dependencies": [
      "naval pathing maps",
      "sonar/detection contract",
      "carrier component"
    ],
    "conflicts": []
  },
  "integration": {
    "files": [
      "engine/openra/mods/ra/experiences/components/naval-combat-archetypes.yaml",
      "engine/openra/mods/ra/experiences.yaml"
    ],
    "feature_flag": "naval-combat-archetypes",
    "migration_notes": "Enable in Experience Composer, then inherit the reusable templates or consume the stable capability IDs in concrete faction, AI, or mission data."
  },
  "verification": {
    "lint": "passed",
    "build": "passed",
    "automated": "passed",
    "live": "pending",
    "evidence": [
      "Isolated OpenRA.Mods.Common build completed with zero errors.",
      "Default RA rules and the bundled map corpus load with the component in the World War III profile.",
      "The release-style reuse gate passed isolated builds, the complete RA map and Fluent scan, interface contract checks, pinned-source inventory validation, component graph validation, and exact asset provenance hashes."
    ]
  }
}
