{
  "schema_version": 1,
  "id": "teleport-network",
  "name": "Teleport Network",
  "kind": "trait",
  "status": "integrated",
  "summary": "A networked entrance/exit abstraction can later power tunnels, rapid transit, forward logistics, or science-fiction factions.",
  "sources": [
    {
      "project": "openhv",
      "commit": "d507035349b05a774baedbdebd2e60abb6c57895",
      "paths": [
        "OpenRA.Mods.HV/Traits/TeleportNetwork.cs"
      ],
      "notes": "Mechanic or architecture reference only; no upstream story or binary presentation content imported."
    }
  ],
  "license": {
    "code": "GPL-3.0-or-later",
    "assets": "No upstream binary assets imported; original or native OpenRA presentation is required.",
    "redistribution": "allowed",
    "attribution": [
      "OpenHV contributors"
    ]
  },
  "compatibility": {
    "target_mod": "ra",
    "engine_api": "native",
    "dependencies": [
      "network manager",
      "exit selection",
      "AI routing"
    ],
    "conflicts": []
  },
  "integration": {
    "files": [
      "engine/openra/mods/ra/experiences/components/teleport-network.yaml",
      "engine/openra/mods/ra/experiences.yaml"
    ],
    "feature_flag": "teleport-network",
    "migration_notes": "Enable in Experience Composer, then inherit the reusable templates or consume the stable capability IDs in concrete faction, AI, or mission data."
  },
  "verification": {
    "lint": "passed",
    "build": "passed",
    "automated": "passed",
    "live": "pending",
    "evidence": [
      "Isolated OpenRA.Mods.Common build completed with zero errors.",
      "Default RA rules and the bundled map corpus load with the component in the World War III profile.",
      "The release-style reuse gate passed isolated builds, the complete RA map and Fluent scan, interface contract checks, pinned-source inventory validation, component graph validation, and exact asset provenance hashes."
    ]
  }
}
