{
  "schema_version": 1,
  "id": "capture-technology",
  "name": "Capture Technology",
  "kind": "trait",
  "status": "integrated",
  "summary": "Capturing enemy technology can unlock controlled hybrid rosters and mission-specific rewards.",
  "sources": [
    {
      "project": "combined-arms",
      "commit": "ab9e477c3db818e91946d4cfdc86e71012966141",
      "paths": [
        "OpenRA.Mods.CA/Traits/Player/CapturedFactionsManager.cs"
      ],
      "notes": "Mechanic or architecture reference only; no upstream story or binary presentation content imported."
    }
  ],
  "license": {
    "code": "GPL-3.0-or-later",
    "assets": "No upstream binary assets imported; original or native OpenRA presentation is required.",
    "redistribution": "allowed",
    "attribution": [
      "Combined Arms contributors"
    ]
  },
  "compatibility": {
    "target_mod": "ra",
    "engine_api": "native",
    "dependencies": [
      "faction contract",
      "capturable tech structures"
    ],
    "conflicts": []
  },
  "integration": {
    "files": [
      "engine/openra/mods/ra/experiences/components/capture-technology.yaml",
      "engine/openra/OpenRA.Mods.Common/Traits/WorldWarIII/CapturedTechnology.cs",
      "engine/openra/mods/ra/experiences.yaml"
    ],
    "feature_flag": "capture-technology",
    "migration_notes": "Enable in Experience Composer, then inherit the reusable templates or consume the stable capability IDs in concrete faction, AI, or mission data."
  },
  "verification": {
    "lint": "passed",
    "build": "passed",
    "automated": "pending",
    "live": "pending",
    "evidence": [
      "Isolated OpenRA.Mods.Common build completed with zero errors.",
      "Default RA rules and the bundled map corpus load with the component in the World War III profile."
    ]
  }
}
