{
  "schema_version": 1,
  "id": "ground-force-archetypes",
  "name": "Ground Force Archetypes",
  "kind": "strategy",
  "status": "integrated",
  "summary": "Role-tagged templates for rifle, AT, AA, engineer, commando, scout, APC, MBT, artillery, MLRS, tank destroyer, and recovery units.",
  "sources": [
    {
      "project": "combined-arms",
      "commit": "ab9e477c3db818e91946d4cfdc86e71012966141",
      "paths": [
        "mods/ca/rules/vehicles.yaml"
      ],
      "notes": "Mechanic or architecture reference only; no upstream story or binary presentation content imported."
    }
  ],
  "license": {
    "code": "GPL-3.0-or-later",
    "assets": "No upstream binary assets imported; original or native OpenRA presentation is required.",
    "redistribution": "allowed",
    "attribution": [
      "Combined Arms contributors"
    ]
  },
  "compatibility": {
    "target_mod": "ra",
    "engine_api": "native",
    "dependencies": [
      "role tag schema",
      "balance envelope",
      "vehicle sprite audit"
    ],
    "conflicts": []
  },
  "integration": {
    "files": [
      "engine/openra/mods/ra/experiences/components/ground-force-archetypes.yaml",
      "engine/openra/mods/ra/experiences.yaml"
    ],
    "feature_flag": "ground-force-archetypes",
    "migration_notes": "Enable in Experience Composer, then inherit the reusable templates or consume the stable capability IDs in concrete faction, AI, or mission data."
  },
  "verification": {
    "lint": "passed",
    "build": "passed",
    "automated": "pending",
    "live": "pending",
    "evidence": [
      "Isolated OpenRA.Mods.Common build completed with zero errors.",
      "Default RA rules and the bundled map corpus load with the component in the World War III profile."
    ]
  }
}
