{
  "schema_version": 1,
  "id": "supply-logistics-economy",
  "name": "Supply Logistics Economy",
  "kind": "trait",
  "status": "integrated",
  "summary": "Discrete supply depots, collectors, delivery docks, and resupply visuals enable convoy interdiction and asymmetric logistics missions.",
  "sources": [
    {
      "project": "generals-alpha",
      "commit": "21217baad7579abcba5dbcccd7935a57050d686e",
      "paths": [
        "OpenRA.Mods.GenSDK/Traits/Supply/SupplyCollector.cs"
      ],
      "notes": "Mechanic or architecture reference only; no upstream story or binary presentation content imported."
    }
  ],
  "license": {
    "code": "GPL-3.0-or-later",
    "assets": "No upstream binary assets imported; original or native OpenRA presentation is required.",
    "redistribution": "allowed",
    "attribution": [
      "Generals Alpha contributors"
    ]
  },
  "compatibility": {
    "target_mod": "ra",
    "engine_api": "native",
    "dependencies": [
      "economy design decision",
      "AI collector support"
    ],
    "conflicts": []
  },
  "integration": {
    "files": [
      "engine/openra/mods/ra/experiences/components/supply-logistics-economy.yaml",
      "engine/openra/mods/ra/experiences.yaml"
    ],
    "feature_flag": "supply-logistics-economy",
    "migration_notes": "Enable in Experience Composer, then inherit the reusable templates or consume the stable capability IDs in concrete faction, AI, or mission data."
  },
  "verification": {
    "lint": "passed",
    "build": "passed",
    "automated": "pending",
    "live": "pending",
    "evidence": [
      "Isolated OpenRA.Mods.Common build completed with zero errors.",
      "Default RA rules and the bundled map corpus load with the component in the World War III profile."
    ]
  }
}
