{
  "schema_version": 1,
  "id": "air-attack-profiles",
  "name": "Air Attack Profiles",
  "kind": "strategy",
  "status": "integrated",
  "summary": "Reusable interceptor, dive/loft attack, bomber run, gunship, transport, and return-to-base behavior profiles.",
  "sources": [
    {
      "project": "combined-arms",
      "commit": "ab9e477c3db818e91946d4cfdc86e71012966141",
      "paths": [
        "OpenRA.Mods.CA/Traits/ReturnsToBaseOnAmmoDepleted.cs"
      ],
      "notes": "Mechanic or architecture reference only; no upstream story or binary presentation content imported."
    }
  ],
  "license": {
    "code": "GPL-3.0-or-later",
    "assets": "No upstream binary assets imported; original or native OpenRA presentation is required.",
    "redistribution": "allowed",
    "attribution": [
      "Combined Arms contributors"
    ]
  },
  "compatibility": {
    "target_mod": "ra",
    "engine_api": "native",
    "dependencies": [
      "current dive-attack refactor",
      "air doctrine AI",
      "sprite facing audit"
    ],
    "conflicts": []
  },
  "integration": {
    "files": [
      "engine/openra/mods/ra/experiences/components/air-attack-profiles.yaml",
      "engine/openra/mods/ra/experiences.yaml"
    ],
    "feature_flag": "air-attack-profiles",
    "migration_notes": "Enable in Experience Composer, then inherit the reusable templates or consume the stable capability IDs in concrete faction, AI, or mission data."
  },
  "verification": {
    "lint": "passed",
    "build": "passed",
    "automated": "pending",
    "live": "pending",
    "evidence": [
      "Isolated OpenRA.Mods.Common build completed with zero errors.",
      "Default RA rules and the bundled map corpus load with the component in the World War III profile."
    ]
  }
}
