{
  "schema_version": 1,
  "id": "weather-and-battlefield-lighting",
  "name": "Weather And Battlefield Lighting",
  "kind": "effect",
  "status": "integrated",
  "summary": "Mission-controlled sandstorms, rain, night lighting, and visibility modifiers add authored atmosphere and tactical variation.",
  "sources": [
    {
      "project": "openra-ra2",
      "commit": "61e24e3c1d7b586aa55a86096d29e1559aa9b994",
      "paths": [
        "OpenRA.Mods.RA2/Traits/WeatherControlSupportPower.cs"
      ],
      "notes": "Mechanic or architecture reference only; no upstream story or binary presentation content imported."
    }
  ],
  "license": {
    "code": "GPL-3.0-or-later",
    "assets": "No upstream binary assets imported; original or native OpenRA presentation is required.",
    "redistribution": "allowed",
    "attribution": [
      "OpenRA Red Alert 2 contributors"
    ]
  },
  "compatibility": {
    "target_mod": "ra",
    "engine_api": "native",
    "dependencies": [
      "palette/post-process compatibility",
      "deterministic gameplay modifiers"
    ],
    "conflicts": []
  },
  "integration": {
    "files": [
      "engine/openra/mods/ra/experiences/components/weather-and-battlefield-lighting.yaml",
      "engine/openra/mods/ra/experiences.yaml"
    ],
    "feature_flag": "weather-and-battlefield-lighting",
    "migration_notes": "Enable in Experience Composer, then inherit the reusable templates or consume the stable capability IDs in concrete faction, AI, or mission data."
  },
  "verification": {
    "lint": "passed",
    "build": "passed",
    "automated": "pending",
    "live": "pending",
    "evidence": [
      "Isolated OpenRA.Mods.Common build completed with zero errors.",
      "Default RA rules and the bundled map corpus load with the component in the World War III profile."
    ]
  }
}
