{
  "schema_version": 1,
  "id": "asset-import-audit-pipeline",
  "name": "Asset Import Audit Pipeline",
  "kind": "asset-pipeline",
  "status": "integrated",
  "summary": "Prevents broken facings, pivots, palettes, and legally ambiguous sprites from entering playable factions.",
  "sources": [
    {
      "project": "openra-mod-sdk",
      "commit": "df103939c7e472e715b9fce7cbaf7e35b54dc037",
      "paths": [
        "README.md"
      ],
      "notes": "Mechanic or architecture reference only; no upstream story or binary presentation content imported."
    }
  ],
  "license": {
    "code": "GPL-3.0-or-later",
    "assets": "No upstream binary assets imported; original or native OpenRA presentation is required.",
    "redistribution": "allowed",
    "attribution": [
      "OpenRA Mod SDK contributors"
    ]
  },
  "compatibility": {
    "target_mod": "ra",
    "engine_api": "native",
    "dependencies": [
      "sprite contact sheets",
      "live turning capture",
      "license metadata"
    ],
    "conflicts": []
  },
  "integration": {
    "files": [
      "engine/openra/mods/ra/experiences/components/asset-import-audit-pipeline.yaml",
      "docs/upstream-reuse/asset.schema.json",
      "docs/upstream-reuse/assets/red-sea-directional-vehicles.json",
      "scripts/check_openra_asset_provenance.py",
      "engine/openra/mods/ra/experiences.yaml"
    ],
    "feature_flag": "asset-import-audit-pipeline",
    "migration_notes": "Enable in Experience Composer, then inherit the reusable templates or consume the stable capability IDs in concrete faction, AI, or mission data."
  },
  "verification": {
    "lint": "passed",
    "build": "passed",
    "automated": "pending",
    "live": "pending",
    "evidence": [
      "Isolated OpenRA.Mods.Common build completed with zero errors.",
      "Default RA rules and the bundled map corpus load with the component in the World War III profile."
    ]
  }
}
