{
  "schema_version": 1,
  "id": "unit-composition-doctrine-ai",
  "name": "Unit Composition Doctrine Ai",
  "kind": "ai-module",
  "status": "integrated",
  "summary": "Builds recognizable combined-arms formations instead of independent unit ratios, with faction-specific doctrine templates.",
  "sources": [
    {
      "project": "combined-arms",
      "commit": "ab9e477c3db818e91946d4cfdc86e71012966141",
      "paths": [
        "OpenRA.Mods.CA/Traits/BotModules/UnitCompositionsBotModule.cs"
      ],
      "notes": "Mechanic or architecture reference only; no upstream story or binary presentation content imported."
    }
  ],
  "license": {
    "code": "GPL-3.0-or-later",
    "assets": "No upstream binary assets imported; original or native OpenRA presentation is required.",
    "redistribution": "allowed",
    "attribution": [
      "Combined Arms contributors"
    ]
  },
  "compatibility": {
    "target_mod": "ra",
    "engine_api": "native",
    "dependencies": [
      "stable actor role tags",
      "Saudi/Yemen doctrine definitions"
    ],
    "conflicts": []
  },
  "integration": {
    "files": [
      "engine/openra/mods/ra/experiences/components/unit-composition-doctrine-ai.yaml",
      "engine/openra/OpenRA.Mods.Common/Traits/BotModules/UnitBuilderBotModule.cs",
      "engine/openra/mods/ra/experiences.yaml"
    ],
    "feature_flag": "unit-composition-doctrine-ai",
    "migration_notes": "Enable in Experience Composer, then inherit the reusable templates or consume the stable capability IDs in concrete faction, AI, or mission data."
  },
  "verification": {
    "lint": "passed",
    "build": "passed",
    "automated": "passed",
    "live": "pending",
    "evidence": [
      "Isolated OpenRA.Mods.Common build completed with zero errors.",
      "Default RA rules and the bundled map corpus load with the component in the World War III profile.",
      "The release-style reuse gate passed isolated builds, the complete RA map and Fluent scan, interface contract checks, pinned-source inventory validation, component graph validation, and exact asset provenance hashes."
    ]
  }
}
