{
  "schema_version": 1,
  "id": "minefield-generator",
  "name": "Replenishing minefield generator",
  "kind": "trait",
  "status": "integrated",
  "summary": "Allows a structure or scripted proxy to maintain a deterministic pattern of anti-personnel or anti-vehicle mines without duplicate stacking.",
  "sources": [
    {
      "project": "combined-arms",
      "commit": "ab9e477c3db818e91946d4cfdc86e71012966141",
      "paths": [
        "OpenRA.Mods.CA/Traits/LaysMinefield.cs"
      ],
      "notes": "Primary implementation; adapted to validate placement before creation and replenish only empty slots."
    },
    {
      "project": "generals-alpha",
      "commit": "21217baad7579abcba5dbcccd7935a57050d686e",
      "paths": [
        "OpenRA.Mods.GenSDK/Traits/LaysMinefield.cs"
      ],
      "notes": "Secondary reference for the Generals-style use case."
    }
  ],
  "license": {
    "code": "GPL-3.0-or-later",
    "assets": "No upstream assets imported",
    "redistribution": "allowed",
    "attribution": [
      "OpenRA Combined Arms developers",
      "MustaphaTR / Generals Alpha contributors"
    ]
  },
  "compatibility": {
    "target_mod": "ra",
    "engine_api": "native",
    "dependencies": [
      "IPositionableInfo",
      "mine actor definitions such as MINV and MINP"
    ],
    "conflicts": []
  },
  "integration": {
    "files": [
      "engine/openra/OpenRA.Mods.Common/Traits/WorldWarIII/LaysMinefield.cs",
      "engine/openra/mods/ra/experiences/components/minefield-generator.yaml",
      "engine/openra/mods/ra/mod.yaml"
    ],
    "feature_flag": null,
    "migration_notes": "Inherit ^ReusableMinefieldGenerator, then override Mines, Locations, timing, and RequiresCondition for faction balance. The abstract component does not change existing units until a concrete actor opts in."
  },
  "verification": {
    "lint": "passed",
    "build": "passed",
    "automated": "passed",
    "live": "pending",
    "evidence": [
      "Isolated Debug build of OpenRA.Mods.Cnc/OpenRA.Mods.Common completed with 0 errors.",
      "OpenRA.Utility ra --check-yaml passed after loading the abstract RA component and validating all bundled RA maps, sequences, and Fluent references.",
      "OpenRA.Utility all --check-explicit-interfaces and --check-conditional-trait-interface-overrides passed.",
      "The release-style reuse gate passed isolated builds, the complete RA map and Fluent scan, interface contract checks, pinned-source inventory validation, component graph validation, and exact asset provenance hashes."
    ]
  }
}
